{
  "$schemaVersion": "1.0.0",
  "runId": "2026-05-provider-no-vms-001",
  "createdAt": "2026-05-05T00:30:00Z",
  "vmName": "no-registered-lab-vm",
  "provider": "Parallels",
  "providerVersion": "Parallels Desktop 26.3.2-57398",
  "snapshot": "Inventory-Only",
  "fidelity": "Yellow",
  "hardwareSignoffRequired": true,
  "providerVersionMatrix": {
    "hostMacOS": "26.4.1",
    "hostMacOSBuild": "25E253",
    "guestMacOS": "26.4.1",
    "guestBuild": "25E253",
    "hostGuestCompatibility": "same-major-supported",
    "parallelsVersion": "26.3.2-57398",
    "utmVersion": "4.7.5",
    "tartVersion": null,
    "powerShellVersion": "7.4.0",
    "pesterVersion": "5.7.1",
    "defenderVersion": null,
    "intunePolicySetId": "not-configured",
    "providerManualStepGaps": [
      "utm-create",
      "utm-checkpoint",
      "utm-restore-checkpoint"
    ],
    "providerIsolationState": {
      "hostSharingDisabled": true,
      "sharedClipboardDisabled": true,
      "sharedApplicationsDisabled": true,
      "smartMountDisabled": true,
      "cameraSharingDisabled": true,
      "bluetoothSharingDisabled": true,
      "hostLocationSharingDisabled": true
    }
  },
  "intuneDeviceName": null,
  "intuneDeviceIdRedacted": null,
  "tenantSuffixOnly": null,
  "redactionApplied": true,
  "redactionVersion": "1.0.0",
  "cloudStateWarning": "VM rollback does not rewind Intune, Entra, Defender portal state, audit logs, or reporting history.",
  "tests": [
    {
      "name": "Parallels installed with no registered VMs",
      "kind": "ProviderInventory",
      "result": "Warn",
      "expectedFailure": false,
      "evidenceRefs": [
        "parallels-list-empty.txt"
      ]
    },
    {
      "name": "UTM installed with no registered VMs",
      "kind": "ProviderInventory",
      "result": "Warn",
      "expectedFailure": false,
      "evidenceRefs": [
        "utm-list-empty.txt"
      ]
    }
  ]
}
